<?xml version="1.0" encoding="UTF-8"?>
<xs:schema attributeFormDefault="unqualified" elementFormDefault="qualified" xmlns:xs="http://www.w3.org/2001/XMLSchema">

<xs:simpleType name="titel">
  <xs:restriction base="xs:string">
	<xs:minLength value="1"/>
  </xs:restriction>
</xs:simpleType>

<xs:simpleType name="jahr">
  <xs:restriction base="xs:int">
	<xs:maxExclusive value="2014"/>
  </xs:restriction>
</xs:simpleType>

<xs:simpleType name="monat">
  <xs:restriction base="xs:int">
	<xs:minExclusive value="0"/>
	<xs:maxExclusive value="13"/>
  </xs:restriction>
</xs:simpleType>

<xs:simpleType name="tag">
  <xs:restriction base="xs:int">
	<xs:minExclusive value="0"/>
	<xs:maxExclusive value="32"/>
  </xs:restriction>
</xs:simpleType>

<xs:simpleType name="menge">
  <xs:restriction base="xs:float">
	<xs:minExclusive value="0"/>
  </xs:restriction>
</xs:simpleType>

<xs:simpleType name="schwierigkeitsgrad">
   <xs:restriction base="xs:string">
     <xs:enumeration value="simple"/>
     <xs:enumeration value="normal"/>
     <xs:enumeration value="pfiffig"/>
   </xs:restriction>
 </xs:simpleType>

  <xs:element name="Rezepte">
    <xs:complexType>
      <xs:sequence>
        <xs:element name="Rezept" maxOccurs="unbounded">
          <xs:complexType>
            <xs:sequence>	
              <xs:element type="titel" name="Titel"/>		
              <xs:element type="xs:string" name="Beschreibung"/>
              <xs:element name="Bilder">
                <xs:complexType>
                  <xs:sequence>
                  	<xs:element name="Bild" maxOccurs="unbounded" minOccurs="0">
                      <xs:complexType>
                      	<xs:sequence>
                    		<xs:element type="xs:int" name="Nummer"/>
                    		<xs:element type="xs:string" name="Quelle"/>
                    		<xs:element type="xs:string" name="Titel"/>
                    	</xs:sequence>
                      </xs:complexType>
                    </xs:element>
                  </xs:sequence>
                </xs:complexType>
              </xs:element>
              <xs:element name="Zutaten">
                <xs:complexType>
                  <xs:sequence>
                    <xs:element name="Zutat" maxOccurs="unbounded" minOccurs="0">
                      <xs:complexType>
                        <xs:sequence>
                          <xs:element type="menge" name="Menge"/>
                          <xs:element type="xs:string" name="Einheit"/>
                          <xs:element type="xs:string" name="Name"/>
                        </xs:sequence>
                      </xs:complexType>
                    </xs:element>
                  </xs:sequence>
                  <xs:attribute type="xs:int" name="portion_id" use="required"/>
                </xs:complexType>
              </xs:element>
              <xs:element name="Zubereitung">
                <xs:complexType>
                  <xs:sequence>
                    <xs:element name="Arbeitszeit">
                      <xs:complexType mixed="true">
                        <xs:sequence>
                          <xs:element type="xs:string" name="Einheit"/>
                        </xs:sequence>
                      </xs:complexType>
                    </xs:element>
                    <xs:element type="schwierigkeitsgrad" name="Schwierigkeitsgrad"/>
                    <xs:element name="Brennwert">
                      <xs:complexType mixed="true">
                        <xs:sequence>
                          <xs:element type="xs:string" name="Einheit"/>
                        </xs:sequence>
                      </xs:complexType>
                    </xs:element>
                    <xs:element type="xs:string" name="Text"/>
                  </xs:sequence>
                </xs:complexType>
              </xs:element>
              <xs:element name="Kommentare">
                <xs:complexType>
                  <xs:sequence>
                    <xs:element type="xs:string" name="Titel"/>
                    <xs:element name="Kommentar">
                      <xs:complexType>
                        <xs:sequence>
                          <xs:element type="xs:string" name="Nutzer"/>
                          <xs:element type="xs:string" name="Avatar"/>
                          <xs:element name="Zeitstempel">
                            <xs:complexType>
                              <xs:sequence>
                                <xs:element type="tag" name="Tag"/>
                                <xs:element type="monat" name="Monat"/>
                                <xs:element type="jahr" name="Jahr"/>
                              </xs:sequence>
                            </xs:complexType>
                          </xs:element>
                          <xs:element type="xs:string" name="Text"/>
                          <xs:element type="xs:string" name="Hilfreich"/>
                        </xs:sequence>
                        <xs:attribute type="xs:int" name="kommentar_id" use="required"/>
                      </xs:complexType>
                    </xs:element>
                  </xs:sequence>
                </xs:complexType>
              </xs:element>
            </xs:sequence>
            <xs:attribute type="xs:int" name="rezept_id" use="required"/>
          </xs:complexType>
        </xs:element>
      </xs:sequence>
    </xs:complexType>
  </xs:element>
</xs:schema>