<?xml version="1.0" encoding="utf-8"?>
<Rezepte xmlns:xsi="http://www.w3.org/2001/XMLSchema-instance" xsi:noNamespaceSchemaLocation="Aufgabe3c.xsd">
  <Rezept rezept_id="3">
    <Titel>Nußecken</Titel>
    <Beschreibung>str1234</Beschreibung>
    <Bilder>
      <Bild>
        <Nummer>150</Nummer>
        <Quelle>img/cake.jpg</Quelle>
        <Titel>Foto von Schokoliebe </Titel>
      </Bild>
    </Bilder>
    <Zutaten portion_id="32">
      <Zutat>
        <Menge>130</Menge>
        <Einheit>g</Einheit>
        <Name>Butter oder Margarine</Name>
      </Zutat>
      <Zutat>
        <Menge>130</Menge>
        <Einheit>g</Einheit>
        <Name>Zucker</Name>
      </Zutat>
      <Zutat>
        <Menge>2</Menge>
        <Einheit></Einheit>
        <Name>Eier</Name>
      </Zutat>
      <Zutat>
        <Menge>1</Menge>
        <Einheit>TL</Einheit>
        <Name>Backpulver</Name>
      </Zutat>
      <Zutat>
        <Menge></Menge>
        <Einheit></Einheit>
        <Name>Für den Belag</Name>
      </Zutat>
      <Zutat>
        <Menge>4</Menge>
        <Einheit>EL</Einheit>
        <Name>Aprokosenkonfitüre</Name>
      </Zutat>
      <Zutat>
        <Menge>200</Menge>
        <Einheit>g</Einheit>
        <Name>Butter oder Margarine</Name>
      </Zutat>
      <Zutat>
        <Menge>200</Menge>
        <Einheit>g</Einheit>
        <Name>Zucker</Name>
      </Zutat>
      <Zutat>
        <Menge>2</Menge>
        <Einheit>Pkt.</Einheit>
        <Name>Vanillezucker</Name>
      </Zutat>
      <Zutat>
        <Menge>200</Menge>
        <Einheit>g</Einheit>
        <Name>Haselnüsse,gemahlen</Name>
      </Zutat>
      <Zutat>
        <Menge>200</Menge>
        <Einheit>g</Einheit>
        <Name>Haselnüsse,gehackt</Name>
      </Zutat>
      <Zutat>
        <Menge>4</Menge>
        <Einheit>EL</Einheit>
        <Name>Wasser</Name>
      </Zutat>
      <Zutat>
        <Menge></Menge>
        <Einheit></Einheit>
        <Name>Kuchenglasur, Schokolade</Name>
      </Zutat>
    </Zutaten>
    <Zubereitung>
      <Arbeitszeit>45
        <Einheit>Min</Einheit>
      </Arbeitszeit>
      <Schwierigkeitsgrad>normal</Schwierigkeitsgrad>
      <Brennwert>
        <Einheit></Einheit>
      </Brennwert>
      <Text><![CDATA[]]></Text>
    </Zubereitung>
    <Kommentare>
      <Titel>Kommentare anderer Nutzer</Titel>
      <Kommentar kommentar_id="1">
        <Nutzer>wellness-line</Nutzer>
        <Avatar>img/profilbild.png</Avatar>
        <Zeitstempel>
          <Tag>12</Tag>
          <Monat>12</Monat>
          <Jahr>2012</Jahr>
        </Zeitstempel>
        <Text><![CDATA[Ein absoluter Volltreffer! Ich verstehe gar nicht, warum bisher noch keine Kommentare dazu abgegeben wurden. 
		Mit diesem Rezept legt man alle Ehre ein - auch immer gut als Geschenk in einer schönen Dose .... 
		Nachbacken lohnt sich garantiert! Schmecken hervorragend. 
		Mein Tipp: Ich nehme ein ganzes Glas Aprikosenmarmelade, werden dann noch saftiger!]]></Text>
        <Hilfreich>ja</Hilfreich>
      </Kommentar>
    </Kommentare>
  </Rezept>
</Rezepte>